{
  "schema_version": "2.0.0",
  "dataset_version": "0.3.0",
  "generated_at": "2026-10-29T10:22:52.232811+00:00",
  "last_validation_timestamp": "2026-10-29T10:22:52.232833+00:00",
  "target_country_count": 15,
  "actual_country_count": 15,
  "country_list": [
    "BR",
    "CN",
    "DE",
    "EG",
    "GB",
    "GR",
    "ID",
    "IE",
    "IN",
    "JP",
    "KR",
    "MX",
    "NG",
    "PH",
    "US"
  ],
  "required_record_count": 300,
  "total_target_records": 300,
  "target_breakdown": {
    "per_country_folklore": 10,
    "per_country_urban_legends": 10,
    "total_countries": 15
  },
  "target_records_per_category": {
    "folklore": 10,
    "urban_legends": 10
  },
  "current_actual_counts": {
    "total_records": 300,
    "folklore_records": 150,
    "urban_legend_records": 150
  },
  "actual_record_count": 300,
  "folklore_counts_by_country": {
    "BR": 10,
    "CN": 10,
    "DE": 10,
    "EG": 10,
    "GB": 10,
    "GR": 10,
    "ID": 10,
    "IE": 10,
    "IN": 10,
    "JP": 10,
    "KR": 10,
    "MX": 10,
    "NG": 10,
    "PH": 10,
    "US": 10
  },
  "urban_legend_counts_by_country": {
    "BR": 10,
    "CN": 10,
    "DE": 10,
    "EG": 10,
    "GB": 10,
    "GR": 10,
    "ID": 10,
    "IE": 10,
    "IN": 10,
    "JP": 10,
    "KR": 10,
    "MX": 10,
    "NG": 10,
    "PH": 10,
    "US": 10
  },
  "published_and_verified_records": 300,
  "unverified_records": 0,
  "unverified_candidates": 0,
  "rejected_records": 0,
  "rights_pending_records": 0,
  "metadata_only_records": 0,
  "records_by_content_origin": {
    "original_summary": 300
  },
  "records_by_source": {
    "O Sacy: Inquérito sobre o Saci-Pererê no Folclore Brasileiro": 1,
    "Cartas jesuíticas: Cartas, informações, fragmentos históricos (1554-1594)": 1,
    "O Folclore Brasileiro: A Lenda da Iara e os Mitos das Águas": 1,
    "Cartas Jesuíticas: Informações dos Costumes dos Índios (Mboi-tatá)": 1,
    "Contos Tradicionais do Brasil: O Boto e os Encantados do Rio": 1,
    "Geografia dos Mitos Brasileiros: A Mula Sem Cabeça": 1,
    "Mitos e Lendas do Brasil: O Caipora e a Fauna Silvestre": 1,
    "The Search for the Mapinguari: Extinct Sloths in Amazonian Folklore": 1,
    "Lendas do Sul: O Negrinho do Pastoreio": 1,
    "Prefeitura de Belém: Mitos Amazônicos e a Lenda da Cobra Grande": 1,
    "Chinese Folk-Lore Tales: The Story of Liang Shanbo and Zhu Yingtai": 1,
    "Myths and Legends of China: The Moon Maiden and the Divine Archer": 1,
    "The Legend of the White Snake: A Comprehensive Translation of the Traditional Folk Saga": 1,
    "The Chinese Fairy Book: The Cowherd and the Weaving Maiden": 1,
    "Myths and Legends of China: Hou Yi and the Ten Suns": 1,
    "Creation of the Gods (Fengshen Yanyi): The Birth and Feats of Nezha": 1,
    "Journey to the West: The Great Sage Equal to Heaven and the Heavenly Peaches": 1,
    "Chinese Folk-Lore: The Legend of the Faithful Wife Meng Jiang Nü": 1,
    "Festivals and Folklore of Traditional China: The Story of the Nian Beast": 1,
    "Myths and Legends of China: Pan Gu and the Creation of the Universe": 1,
    "Household Tales by the Brothers Grimm: The Children of Hameln": 1,
    "The Poems of Heine: Die Loreley (Book of Songs)": 1,
    "Grimms' Fairy Tales: Little Snow-White (Kinder- und Hausmärchen KHM 53)": 1,
    "Grimms' Fairy Tales: Hansel and Gretel (KHM 15)": 1,
    "Grimms' Fairy Tales: Rumpelstiltskin (KHM 55)": 1,
    "Grimms' Fairy Tales: The Bremen Town Musicians (KHM 27)": 1,
    "Teutonic Mythology: Volume III (The Wild Hunt and Wotan's Host)": 1,
    "Faust: A Tragedy (Parts I and II)": 1,
    "The German Legends of the Brothers Grimm: Volume I (Water Spirits and Nixies)": 1,
    "Teutonic Mythology: Volume II (Wights, Elves and Kobolds of the Mines)": 1,
    "The Gods of the Egyptians: Studies in Egyptian Mythology (The Legend of Osiris and Isis)": 1,
    "Egyptian Tales, Translated from the Papyri: Second Series (The Doomed Prince)": 1,
    "Egyptian Tales, Translated from the Papyri: First Series (The Shipwrecked Sailor)": 1,
    "Egyptian Tales, Translated from the Papyri: Second Series (Anpu and Bata)": 1,
    "Legends of the Gods: The Legend of Ra and Isis": 1,
    "Egyptian Magic: The Amulet of the Eye of Horus (Wedjat)": 1,
    "Egyptian Tales, Translated from the Papyri: Second Series (The Peasant and the Workman)": 1,
    "Egyptian Tales: First Series: Tales of the Magicians (The Westcar Papyrus)": 1,
    "Legends of the Gods: The Creation of Men and Their Destruction by Hathor-Sekhmet": 1,
    "Library of Congress: Historical Records of the Giza Sphinx and the Dream Stele": 1,
    "Le Morte d'Arthur: Sir Thomas Malory's Book of King Arthur and of His Noble Knights": 1,
    "The Merry Adventures of Robin Hood of Great Renown in Nottinghamshire": 1,
    "English Fairy Tales: Jack and the Beanstalk": 1,
    "Lady Godiva: A History and a Legend (Studies in English Folklore)": 1,
    "Historia Rerum Anglicarum: The Green Children of Woolpit": 1,
    "The Merry Wives of Windsor (Act IV, Scene 4: The Tale of Herne the Hunter)": 1,
    "The Folk-Lore of the Northern Counties of England and the Borders": 1,
    "A Straunge and Terrible Wunder: The Black Dog of Bungay (1577 Pamphlet)": 1,
    "English Fairy Tales: The History of Dick Whittington": 1,
    "Life of Saint Columba, Founder of Hy: Book II, Chapter 27 (The Water Beast)": 1,
    "The Library of Apollodorus: The Epitome (Theseus on Crete)": 1,
    "Ovid's Metamorphoses: Book VIII (Daedalus and Icarus)": 1,
    "Hesiod, The Homeric Hymns, and Homerica (The Shield of Heracles and Theogony)": 1,
    "The Georgics of Virgil: Book IV (The Story of Orpheus and Eurydice)": 1,
    "The Prometheus Bound of Aeschylus": 1,
    "The Argonautica of Apollonius Rhodius": 1,
    "The Library of Apollodorus: Book II (The Labours of Heracles)": 1,
    "Modern Greek Folklore and Ancient Greek Religion: The Legend of the Gorgona": 1,
    "The Folklore of Chios and the Greek Archipelago: Nereids and Fairies": 1,
    "A Voyage into the Levant: Volume I (The Vrykolakas of Mykonos)": 1,
    "Folk-Tales of the Javanese: The Legend of Prambanan and Princess Roro Jonggrang": 1,
    "Batak Folklore and Mythology: The Legend of Lake Toba": 1,
    "Kementerian Pendidikan dan Kebudayaan: Cerita Rakyat Malin Kundang dan Nilai Karakter": 1,
    "Sundanese Folklore and Legends: The Story of Sangkuriang and Mount Tangkuban Perahu": 1,
    "Balai Pustaka: Kumpulan Dongeng Tradisional Jawa: Kisah Timun Mas": 1,
    "Tales from the Javanese: The Story of Cindelaras and the Royal Court": 1,
    "Rice Cults in Southeast Asia: The Goddess Dewi Sri in Javanese and Balinese Tradition": 1,
    "De Calon Arang: Tekst en Vertaling van het Javaansche Heksenverhaal": 1,
    "Island of Bali: Myth, Magic and the Giant Kebo Iwa": 1,
    "Dinas Kebudayaan Kalimantan Timur: Legenda Sungai Mahakam dan Satwa Keramat": 1,
    "Dúchas: The National Folklore Collection: The Children of Lir": 1,
    "Celtic Wonder-Tales: The Boyhood of Demna (Fionn Mac Cumhaill)": 1,
    "Fairy Legends and Traditions of the South of Ireland": 1,
    "Cuchulain of Muirthemne: The Story of the Men of the Red Branch of Ulster": 1,
    "Dúchas: The National Folklore Collection: Finn MacCool and the Causeway": 1,
    "The Banshee: The Irish Supernatural Death-Messenger": 1,
    "Fairy and Folk Tales of the Irish Peasantry: The Leprecaun": 1,
    "Dúchas: The National Folklore Collection: The Seal People": 1,
    "Dúchas: The National Folklore Collection: Fairy Forts and Raths": 1,
    "The Voyage of Bran, Son of Febal, to the Land of the Living (Studies on Brendan)": 1,
    "The Baital-Pachisi; or, The Twenty-Five Tales of a Demon": 1,
    "The Panchatantra (Book V: Ill-Considered Action)": 1,
    "The Jataka; or, Stories of the Buddha's Former Births (No. 208)": 1,
    "The Mahabharata, Book 3: Vana Parva (Pativrata-mahatmya Parva)": 1,
    "Wit and Wisdom of Tenali Raman": 1,
    "The Hitopadesha of Narayana (Book II: The Separation of Friends)": 1,
    "Indian Fairy Tales: The Tiger, the Brahman, and the Jackal": 1,
    "The Markandeya Purana (Canto VII: Legend of Harishchandra)": 1,
    "Shakuntala, or The Lost Ring": 1,
    "The Ramayana of Valmiki (Aranya Kanda: Canto XLIII)": 1,
    "Japanese Fairy Tales: The Story of Urashima Taro, the Fisher Lad": 1,
    "Japanese Fairy Tales: Momotaro, or the Story of the Son of a Peach": 1,
    "The Tale of the Bamboo Cutter (Taketori Monogatari)": 1,
    "Kwaidan: Stories and Studies of Strange Things: Yuki-Onna": 1,
    "The Noh Drama: Ten Plays from the Japanese (The Death Stone / Sessho-seki)": 1,
    "Folktales of Japan: The Crane Wife (Studies in Japanese Folklore)": 1,
    "Japanese Fairy Tales: The Adventures of Kintaro, the Golden Boy": 1,
    "Japanese Fairy Tales: The Accomplished and Lucky Tea-Kettle": 1,
    "Tales of Old Japan: The Story of the One-Inch Boy": 1,
    "Japanese Fairy Tales: The Tongue-Cut Sparrow": 1,
    "Samguk Yusa: Legends and History of the Three Kingdoms of Ancient Korea": 1,
    "Korean Folk Tales: Imps, Ghosts and Fairies: The Story of Chunhyang": 1,
    "Folk Tales from Korea: The Sun and the Moon": 1,
    "Myths and Legends of the Korean Fox Spirit: Gumiho in Traditional Narrative": 1,
    "Korean Fairy Tales: The Story of the Dutiful Daughter Shim Cheong": 1,
    "The Story of Heungbu and Nolbu: Traditional Korean Folk Narrative and Ethics": 1,
    "Korean Folk Tales: The Fairy and the Woodcutter": 1,
    "The Tale of Hong Kiltong: Korea's Robin Hood and Revolutionary Folk Hero": 1,
    "Myths of the East Sea: Dragon Kings and Coastal Folklore of Korea": 1,
    "Korean Folk Tales: The Toad Groom and the Maiden": 1,
    "The Myths of Mexico and Peru: Popocatepetl and the Sleeping Woman": 1,
    "Rig Veda Americanus: Sacred Songs of the Ancient Mexicans": 1,
    "General History of the Things of New Spain (Florentine Codex): Book 1 - The Gods": 1,